cve,vendor_project,product,vulnerability_name,short_description,date_added,required_action,due_date,in_wild,initial_epss,initial_percentile,initial_date,current_epss,current_percentile,current_date,cvss_v3_base,cvss_v3_severity,cvss_v2_base,epss_delta
CVE-2024-27198,JetBrains,TeamCity,JetBrains TeamCity Authentication Bypass Vulnerability,JetBrains TeamCity contains an authentication bypass vulnerability that allows an attacker to perform admin actions.,2024-03-07,Apply mitigations per vendor instructions or discontinue use of the product if mitigations are unavailable.,2024-03-28,TRUE,0.93047,0.99789,2026-04-20,0.93359,0.99815,2026-04-23,NA,NA,NA,0.0031
CVE-2014-1761,Microsoft,Word,Microsoft Word Memory Corruption Vulnerability,Microsoft Word contains a memory corruption vulnerability which when exploited could allow for remote code execution.,2022-02-15,Apply updates per vendor instructions.,2022-08-15,TRUE,0.93131,0.99797,2026-04-20,0.93336,0.99814,2026-04-23,NA,NA,NA,0.002
CVE-2009-0927,Adobe,Reader and Acrobat,Adobe Reader and Adobe Acrobat Stack-Based Buffer Overflow Vulnerability,Stack-based buffer overflow in Adobe Reader and Adobe Acrobat allows remote attackers to execute arbitrary code.,2022-03-25,Apply updates per vendor instructions.,2022-04-15,TRUE,0.93312,0.99809,2026-04-20,0.93312,0.99811,2026-04-23,NA,NA,NA,0
CVE-2018-10561,Dasan,Gigabit Passive Optical Network (GPON) Routers,Dasan GPON Routers Authentication Bypass Vulnerability,"Dasan GPON Routers contain an authentication bypass vulnerability. When combined with CVE-2018-10562, exploitation can allow an attacker to perform remote code execution.",2022-03-31,The impacted product is end-of-life and should be disconnected if still in use.,2022-04-21,TRUE,0.93311,0.99809,2026-04-20,0.93311,0.99811,2026-04-23,NA,NA,NA,0
CVE-2020-7796,Synacor,Zimbra Collaboration Suite,Synacor Zimbra Collaboration Suite (ZCS) Server-Side Request Forgery Vulnerability,Synacor Zimbra Collaboration Suite (ZCS) contains a server-side request forgery vulnerability if WebEx zimlet installed and zimlet JSP is enabled.,2026-02-17,"Apply mitigations per vendor instructions, follow applicable BOD 22-01 guidance for cloud services, or discontinue use of the product if mitigations are unavailable.",2026-03-10,TRUE,0.93092,0.99793,2026-04-20,0.93303,0.9981,2026-04-23,NA,NA,NA,0.0021
CVE-2017-0146,Microsoft,Windows,Microsoft Windows SMB Remote Code Execution Vulnerability,The SMBv1 server in Microsoft Windows allows remote attackers to perform remote code execution.,2022-03-25,Apply updates per vendor instructions.,2022-04-15,TRUE,0.93295,0.99807,2026-04-20,0.93295,0.99809,2026-04-23,NA,NA,NA,0
CVE-2021-25296,Nagios,Nagios XI,Nagios XI OS Command Injection,Nagios XI contains a vulnerability which can lead to OS command injection on the Nagios XI server.,2022-01-18,Apply updates per vendor instructions.,2022-02-01,TRUE,0.93287,0.99807,2026-04-20,0.93287,0.99809,2026-04-23,NA,NA,NA,0
CVE-2015-7450,IBM,WebSphere Application Server and Server Hypervisor Edition,IBM WebSphere Application Server and Server Hypervisor Edition Code Injection.,"Serialized-object interfaces in certain IBM analytics, business solutions, cognitive, IT infrastructure, and mobile and social products allow remote attackers to execute arbitrary commands",2022-01-10,Apply updates per vendor instructions.,2022-07-10,TRUE,0.93274,0.99806,2026-04-20,0.93274,0.99808,2026-04-23,NA,NA,NA,0
CVE-2023-7028,GitLab,GitLab CE/EE,GitLab Community and Enterprise Editions Improper Access Control Vulnerability,GitLab Community and Enterprise Editions contain an improper access control vulnerability. This allows an attacker to trigger password reset emails to be sent to an unverified email address to ultimately facilitate an account takeover.,2024-05-01,Apply mitigations per vendor instructions or discontinue use of the product if mitigations are unavailable.,2024-05-22,TRUE,0.93543,0.99831,2026-04-20,0.93267,0.99808,2026-04-23,NA,NA,NA,-0.0028
CVE-2017-0145,Microsoft,SMBv1,Microsoft SMBv1 Remote Code Execution Vulnerability,The SMBv1 server in multiple Microsoft Windows versions allows remote attackers to execute arbitrary code via crafted packets.,2022-02-10,Apply updates per vendor instructions.,2022-08-10,TRUE,0.93266,0.99806,2026-04-20,0.93266,0.99807,2026-04-23,NA,NA,NA,0
CVE-2022-43939,Hitachi Vantara,Pentaho Business Analytics (BA) Server,Hitachi Vantara Pentaho BA Server Authorization Bypass Vulnerability,Hitachi Vantara Pentaho BA Server contains a use of non-canonical URL paths for authorization decisions vulnerability that enables an attacker to bypass authorization.,2025-03-03,"Apply mitigations per vendor instructions, follow applicable BOD 22-01 guidance for cloud services, or discontinue use of the product if mitigations are unavailable.",2025-03-24,TRUE,0.93254,0.99805,2026-04-20,0.93254,0.99806,2026-04-23,NA,NA,NA,0
CVE-2023-36884,Microsoft,Windows,Microsoft Windows Search Remote Code Execution Vulnerability,"Microsoft Windows Search contains an unspecified vulnerability that could allow an attacker to evade Mark of the Web (MOTW) defenses via a specially crafted malicious file, leading to remote code execution.",2023-07-17,Apply mitigations per vendor instructions or discontinue use of the product if mitigations are unavailable.,2023-08-29,TRUE,0.9322,0.99803,2026-04-20,0.93245,0.99805,2026-04-23,NA,NA,NA,2e-4
CVE-2020-3580,Cisco,Adaptive Security Appliance (ASA) and Firepower Threat Defense (FTD),Cisco ASA and FTD Cross-Site Scripting (XSS) Vulnerability,Cisco Adaptive Security Appliance (ASA) and Firepower Threat Defense (FTD) contain an insufficient input validation vulnerability for user-supplied input by the web services interface.  Successful exploitation could allow an attacker to perform cross-site scripting (XSS) in the context of the interface or access sensitive browser-based information.,2021-11-03,Apply updates per vendor instructions.,2022-05-03,TRUE,0.93238,0.99804,2026-04-20,0.93238,0.99805,2026-04-23,NA,NA,NA,0
CVE-2015-2545,Microsoft,Office,Microsoft Office Malformed EPS File Vulnerability,Microsoft Office allows remote attackers to execute arbitrary code via a crafted EPS image.,2022-03-03,Apply updates per vendor instructions.,2022-03-24,TRUE,0.93446,0.99822,2026-04-20,0.93232,0.99804,2026-04-23,NA,NA,NA,-0.0021
CVE-2013-2465,Oracle,Java SE,Oracle Java SE Unspecified Vulnerability,"Unspecified vulnerability in the Java Runtime Environment (JRE) component in Oracle Java SE allows remote attackers to affect confidentiality, integrity, and availability via Unknown vectors related to 2D",2022-03-28,Apply updates per vendor instructions.,2022-04-18,TRUE,0.9322,0.99802,2026-04-20,0.9322,0.99802,2026-04-23,NA,NA,NA,0
CVE-2023-34048,VMware,vCenter Server,VMware vCenter Server Out-of-Bounds Write Vulnerability,VMware vCenter Server contains an out-of-bounds write vulnerability in the implementation of the DCERPC protocol that allows an attacker to conduct remote code execution.,2024-01-22,Apply mitigations per vendor instructions or discontinue use of the product if mitigations are unavailable.,2024-02-12,TRUE,0.93213,0.99802,2026-04-20,0.93213,0.99802,2026-04-23,NA,NA,NA,0
CVE-2014-0322,Microsoft,Internet Explorer,Microsoft Internet Explorer Use-After-Free Vulnerability,Use-after-free vulnerability in Microsoft Internet Explorer allows remote attackers to execute code.,2022-05-04,Apply updates per vendor instructions.,2022-05-25,TRUE,0.93203,0.99801,2026-04-20,0.93203,0.99802,2026-04-23,NA,NA,NA,0
CVE-2010-2883,Adobe,Acrobat and Reader,Adobe Acrobat and Reader Stack-Based Buffer Overflow Vulnerability,Adobe Acrobat and Reader contain a stack-based buffer overflow vulnerability that allows remote attackers to execute code or cause denial-of-service (DoS).,2022-06-08,Apply updates per vendor instructions.,2022-06-22,TRUE,0.93195,0.99801,2026-04-20,0.93193,0.99802,2026-04-23,NA,NA,NA,-0
CVE-2014-0497,Adobe,Flash Player,Adobe Flash Player Integer Underflow Vulnerablity,Adobe Flash Player contains an integer underflow vulnerability that allows a remote attacker to execute arbitrary code.,2024-09-17,The impacted product is end-of-life (EoL) and/or end-of-service (EoS). Users should discontinue utilization of the product.,2024-10-08,TRUE,0.93061,0.99791,2026-04-20,0.93156,0.998,2026-04-23,NA,NA,NA,0.001
CVE-2015-5119,Adobe,Flash Player,Adobe Flash Player Use-After-Free Vulnerability,A use-after-free vulnerability exists within the ActionScript 3 ByteArray class in Adobe Flash Player that allows an attacker to perform remote code execution.,2022-03-03,The impacted product is end-of-life and should be disconnected if still in use.,2022-03-24,TRUE,0.93212,0.99802,2026-04-20,0.9315,0.99799,2026-04-23,NA,NA,NA,-6e-4
CVE-2016-6415,Cisco,"IOS, IOS XR, and IOS XE","Cisco IOS, IOS XR, and IOS XE IKEv1 Information Disclosure Vulnerability","Cisco IOS, IOS XR, and IOS XE contain insufficient condition checks in the part of the code that handles Internet Key Exchange version 1 (IKEv1) security negotiation requests. contains an information disclosure vulnerability in the Internet Key Exchange version 1 (IKEv1) that could allow an attacker to retrieve memory contents. Successful exploitation could allow the attacker to retrieve memory contents, which can lead to information disclosure.",2023-05-19,Apply updates per vendor instructions.,2023-06-09,TRUE,0.92999,0.99781,2026-04-20,0.93139,0.99799,2026-04-23,NA,NA,NA,0.0014
CVE-2020-12641,Roundcube,Roundcube Webmail,Roundcube Webmail Remote Code Execution Vulnerability,Roundcube Webmail contains an remote code execution vulnerability that allows attackers to execute code via shell metacharacters in a configuration setting for im_convert_path or im_identify_path.,2023-06-22,Apply updates per vendor instructions.,2023-07-13,TRUE,0.93133,0.99798,2026-04-20,0.93133,0.99797,2026-04-23,NA,NA,NA,0
CVE-2015-3035,TP-Link,Multiple Archer Devices,TP-Link Multiple Archer Devices Directory Traversal Vulnerability,Directory traversal vulnerability in multiple TP-Link Archer devices allows remote attackers to read arbitrary files via a .. (dot dot) in the PATH_INFO to login/.,2022-03-25,Apply updates per vendor instructions.,2022-04-15,TRUE,0.92856,0.99767,2026-04-20,0.93127,0.99797,2026-04-23,NA,NA,NA,0.0027
CVE-2022-27593,QNAP,Photo Station,QNAP Photo Station Externally Controlled Reference Vulnerability,Certain QNAP NAS running Photo Station with internet exposure contain an externally controlled reference to a resource vulnerability which can allow an attacker to modify system files. This vulnerability was observed being utilized in a Deadbolt ransomware campaign.,2022-09-08,Apply updates per vendor instructions.,2022-09-29,TRUE,0.93119,0.99797,2026-04-20,0.93119,0.99796,2026-04-23,NA,NA,NA,0
CVE-2012-1889,Microsoft,XML Core Services,Microsoft XML Core Services Memory Corruption Vulnerability,Microsoft XML Core Services contains a memory corruption vulnerability which could allow for remote code execution.,2022-06-08,Apply updates per vendor instructions.,2022-06-22,TRUE,0.93117,0.99796,2026-04-20,0.93117,0.99796,2026-04-23,NA,NA,NA,0
CVE-2007-5659,Adobe,Acrobat and Reader,Adobe Acrobat and Reader Buffer Overflow Vulnerability,Adobe Acrobat and Reader contain a buffer overflow vulnerability that allows remote attackers to execute code via a PDF file with long arguments to unspecified JavaScript methods.,2022-06-08,Apply updates per vendor instructions.,2022-06-22,TRUE,0.93116,0.99796,2026-04-20,0.93116,0.99795,2026-04-23,NA,NA,NA,0
CVE-2023-25280,D-Link,DIR-820 Router,D-Link DIR-820 Router OS Command Injection Vulnerability,"D-Link DIR-820 routers contain an OS command injection vulnerability that allows a remote, unauthenticated attacker to escalate privileges to root via a crafted payload with the ping_addr parameter to ping.ccp.",2024-09-30,The impacted product is end-of-life (EoL) and/or end-of-service (EoS). Users should discontinue utilization of the product.,2024-10-21,TRUE,0.93112,0.99795,2026-04-20,0.93112,0.99795,2026-04-23,NA,NA,NA,0
CVE-2022-23134,Zabbix,Frontend,Zabbix Frontend Improper Access Control Vulnerability,Malicious actors can pass step checks and potentially change the configuration of Zabbix Frontend.,2022-02-22,Apply updates per vendor instructions.,2022-03-08,TRUE,0.93096,0.99793,2026-04-20,0.93096,0.99794,2026-04-23,NA,NA,NA,0
CVE-2021-31166,Microsoft,HTTP Protocol Stack,Microsoft HTTP Protocol Stack Remote Code Execution Vulnerability,Microsoft HTTP Protocol Stack contains a vulnerability in http.sys that allows for remote code execution.,2022-04-06,Apply updates per vendor instructions.,2022-04-27,TRUE,0.93069,0.99792,2026-04-20,0.93069,0.99792,2026-04-23,NA,NA,NA,0
CVE-2013-0074,Microsoft,Silverlight,Microsoft Silverlight Double Dereference Vulnerability,"Microsoft Silverlight does not properly validate pointers during HTML object rendering, which allows remote attackers to execute code via a crafted Silverlight application.",2022-05-25,The impacted product is end-of-life and should be disconnected if still in use.,2022-06-15,TRUE,0.93054,0.9979,2026-04-20,0.93054,0.99791,2026-04-23,NA,NA,NA,0
CVE-2016-4117,Adobe,Flash Player,Adobe Flash Player Arbitrary Code Execution Vulnerability,An access of resource using incompatible type vulnerability exists within Adobe Flash Player that allows an attacker to perform remote code execution.,2022-03-03,The impacted product is end-of-life and should be disconnected if still in use.,2022-03-24,TRUE,0.93118,0.99796,2026-04-20,0.93052,0.99791,2026-04-23,NA,NA,NA,-7e-4
CVE-2021-32648,October CMS,October CMS,October CMS Improper Authentication,In affected versions of the october/system package an attacker can request an account password reset and then gain access to the account using a specially crafted request.,2022-01-18,Apply updates per vendor instructions.,2022-02-01,TRUE,0.93075,0.99792,2026-04-20,0.93036,0.99788,2026-04-23,8.2,HIGH,6.4,-4e-4
CVE-2018-0171,Cisco,IOS and IOS XE,Cisco IOS and IOS XE Software Smart Install Remote Code Execution Vulnerability,"Cisco IOS and IOS XE Software improperly validates packet data, allowing an unauthenticated, remote attacker to trigger a reload of an affected device, cause a denial-of-service (DoS) condition, or perform code execution on the affected device.",2021-11-03,Apply updates per vendor instructions.,2022-05-03,TRUE,0.93031,0.99786,2026-04-20,0.93031,0.99787,2026-04-23,NA,NA,NA,0
CVE-2019-17621,D-Link,DIR-859 Router,D-Link DIR-859 Router Command Execution Vulnerability,"D-Link DIR-859 router contains a command execution vulnerability in the UPnP endpoint URL, /gena.cgi. Exploitation allows an unauthenticated remote attacker to execute system commands as root by sending a specially crafted HTTP SUBSCRIBE request to the UPnP service when connecting to the local network.",2023-06-29,Apply updates per vendor instructions or discontinue use of the product if updates are unavailable.,2023-07-20,TRUE,0.93009,0.99784,2026-04-20,0.93009,0.99785,2026-04-23,NA,NA,NA,0
CVE-2018-15811,DotNetNuke (DNN),DotNetNuke (DNN),DotNetNuke (DNN) Inadequate Encryption Strength Vulnerability,DotNetNuke (DNN) contains an inadequate encryption strength vulnerability resulting from the use of a weak encryption algorithm to protect input parameters.,2021-11-03,Apply updates per vendor instructions.,2022-05-03,TRUE,0.93004,0.99783,2026-04-20,0.93004,0.99784,2026-04-23,NA,NA,NA,0
CVE-2020-15415,DrayTek,Multiple Vigor Routers,DrayTek Multiple Vigor Routers OS Command Injection Vulnerability,"DrayTek Vigor3900, Vigor2960, and Vigor300B devices contain an OS command injection vulnerability in cgi-bin/mainfunction.cgi/cvmcfgupload that allows for remote code execution via shell metacharacters in a filename when the text/x-python-script content type is used.",2024-09-30,Apply mitigations per vendor instructions or discontinue use of the product if mitigations are unavailable.,2024-10-21,TRUE,0.93003,0.99782,2026-04-20,0.93003,0.99783,2026-04-23,NA,NA,NA,0
CVE-2018-19410,Paessler,PRTG Network Monitor,Paessler PRTG Network Monitor Local File Inclusion Vulnerability,"Paessler PRTG Network Monitor contains a local file inclusion vulnerability that allows a remote, unauthenticated attacker to create users with read-write privileges (including administrator).",2025-02-04,Apply mitigations per vendor instructions or discontinue use of the product if mitigations are unavailable.,2025-02-25,TRUE,0.93002,0.99782,2026-04-20,0.93002,0.99783,2026-04-23,NA,NA,NA,0
CVE-2024-21413,Microsoft,Office Outlook,Microsoft Outlook Improper Input Validation Vulnerability,Microsoft Outlook contains an improper input validation vulnerability that allows for remote code execution. Successful exploitation of this vulnerability would allow an attacker to bypass the Office Protected View and open in editing mode rather than protected mode.,2025-02-06,Apply mitigations per vendor instructions or discontinue use of the product if mitigations are unavailable.,2025-02-27,TRUE,0.92962,0.99779,2026-04-20,0.92992,0.99781,2026-04-23,NA,NA,NA,3e-4
CVE-2015-2051,D-Link,DIR-645 Router,D-Link DIR-645 Router Remote Code Execution Vulnerability,D-Link DIR-645 Wired/Wireless Router allows remote attackers to execute arbitrary commands via a GetDeviceSettings action to the HNAP interface.,2022-02-10,The impacted product is end-of-life and should be disconnected if still in use.,2022-08-10,TRUE,0.92992,0.99781,2026-04-20,0.92992,0.99782,2026-04-23,NA,NA,NA,0
CVE-2015-4852,Oracle,WebLogic Server,Oracle WebLogic Server Deserialization of Untrusted Data Vulnerability,"Oracle WebLogic Server contains a deserialization of untrusted data vulnerability within Apache Commons, which can allow for for remote code execution.",2021-11-03,Apply updates per vendor instructions.,2022-05-03,TRUE,0.92838,0.99765,2026-04-20,0.92977,0.9978,2026-04-23,NA,NA,NA,0.0014
CVE-2023-29552,IETF,Service Location Protocol (SLP),Service Location Protocol (SLP) Denial-of-Service Vulnerability,"The Service Location Protocol (SLP) contains a denial-of-service (DoS) vulnerability that could allow an unauthenticated, remote attacker to register services and use spoofed UDP traffic to conduct a denial-of-service (DoS) attack with a significant amplification factor.",2023-11-08,"Apply mitigations per vendor instructions or disable SLP service or port 427/UDP on all systems running on untrusted networks, including those directly connected to the Internet.",2023-11-29,TRUE,0.92962,0.99779,2026-04-20,0.92962,0.9978,2026-04-23,NA,NA,NA,0
CVE-2018-18325,DotNetNuke (DNN),DotNetNuke (DNN),DotNetNuke (DNN) Inadequate Encryption Strength Vulnerability,DotNetNuke (DNN) contains an inadequate encryption strength vulnerability resulting from the use of a weak encryption algorithm to protect input parameters. This CVE ID resolves an incomplete patch for CVE-2018-15811.,2021-11-03,Apply updates per vendor instructions.,2022-05-03,TRUE,0.9296,0.99778,2026-04-20,0.9296,0.99779,2026-04-23,NA,NA,NA,0
CVE-2024-38112,Microsoft,Windows,Microsoft Windows MSHTML Platform Spoofing Vulnerability,"Microsoft Windows MSHTML Platform contains a spoofing vulnerability that has a high impact to confidentiality, integrity, and availability.",2024-07-09,Apply mitigations per vendor instructions or discontinue use of the product if mitigations are unavailable.,2024-07-30,TRUE,0.92959,0.99778,2026-04-20,0.92959,0.99779,2026-04-23,NA,NA,NA,0
CVE-2009-1151,phpMyAdmin,phpMyAdmin,phpMyAdmin Remote Code Execution Vulnerability,Setup script used to generate configuration can be fooled using a crafted POST request to include arbitrary PHP code in generated configuration file.,2022-03-25,Apply updates per vendor instructions.,2022-04-15,TRUE,0.92956,0.99778,2026-04-20,0.92956,0.99778,2026-04-23,9.8,CRITICAL,7.5,0
CVE-2023-42793,JetBrains,TeamCity,JetBrains TeamCity Authentication Bypass Vulnerability,JetBrains TeamCity contains an authentication bypass vulnerability that allows for remote code execution on TeamCity Server.,2023-10-04,Apply mitigations per vendor instructions or discontinue use of the product if mitigations are unavailable.,2023-10-25,TRUE,0.92913,0.99773,2026-04-20,0.92913,0.99775,2026-04-23,9.8,CRITICAL,NA,0
CVE-2020-15999,Google,Chrome FreeType,Google Chrome FreeType Heap Buffer Overflow Vulnerability,"Google Chrome uses FreeType, an open-source software library to render fonts, which contains a heap buffer overflow vulnerability in the function Load_SBit_Png when processing PNG images embedded into fonts. This vulnerability is part of an exploit chain with CVE-2020-17087 on Windows and CVE-2020-16010 on Android.",2021-11-03,Apply updates per vendor instructions.,2021-11-17,TRUE,0.92905,0.99772,2026-04-20,0.92905,0.99774,2026-04-23,NA,NA,NA,0
CVE-2019-1579,Palo Alto Networks,PAN-OS,Palo Alto Networks PAN-OS Remote Code Execution Vulnerability,Remote Code Execution in PAN-OS with GlobalProtect Portal or GlobalProtect Gateway Interface enabled.,2022-01-10,Apply updates per vendor instructions.,2022-07-10,TRUE,0.92902,0.99772,2026-04-20,0.92902,0.99773,2026-04-23,8.1,HIGH,6.8,0
CVE-2019-1003030,Jenkins,Matrix Project Plugin,Jenkins Matrix Project Plugin Remote Code Execution Vulnerability,"Jenkins Matrix Project plugin contains a vulnerability which can allow users to escape the sandbox, opening opportunity to perform remote code execution.",2022-03-25,Apply updates per vendor instructions.,2022-04-15,TRUE,0.92885,0.99771,2026-04-20,0.92885,0.99773,2026-04-23,NA,NA,NA,0
CVE-2017-8291,Artifex,Ghostscript,Artifex Ghostscript Type Confusion Vulnerability,"Artifex Ghostscript allows -dSAFER bypass and remote command execution via .rsdparams type confusion with a ""/OutputFile.",2022-05-24,Apply updates per vendor instructions.,2022-06-14,TRUE,0.92862,0.99768,2026-04-20,0.92875,0.99771,2026-04-23,NA,NA,NA,1e-4
CVE-2009-4324,Adobe,Acrobat and Reader,Adobe Acrobat and Reader Use-After-Free Vulnerability,Use-after-free vulnerability in Adobe Acrobat and Reader allows remote attackers to execute code via a crafted PDF file.,2022-06-08,Apply updates per vendor instructions.,2022-06-22,TRUE,0.92867,0.99769,2026-04-20,0.92864,0.9977,2026-04-23,NA,NA,NA,-0
CVE-2021-22204,Perl,Exiftool,ExifTool Remote Code Execution Vulnerability,Improper neutralization of user data in the DjVu file format in Exiftool versions 7.44 and up allows arbitrary code execution when parsing the malicious image,2021-11-17,Apply updates per vendor instructions.,2021-12-01,TRUE,0.92856,0.99767,2026-04-20,0.92856,0.99769,2026-04-23,NA,NA,NA,0
CVE-2018-14847,MikroTik,RouterOS,MikroTik Router OS Directory Traversal Vulnerability,MikroTik RouterOS through 6.42 allows unauthenticated remote attackers to read arbitrary files and remote authenticated attackers to write arbitrary files due to a directory traversal vulnerability in the WinBox interface.,2021-12-01,Apply updates per vendor instructions.,2022-06-01,TRUE,0.93645,0.99843,2026-04-20,0.92843,0.99768,2026-04-23,9.1,CRITICAL,6.4,-0.008
CVE-2022-3236,Sophos,Firewall,Sophos Firewall Code Injection Vulnerability,A code injection vulnerability in the User Portal and Webadmin of Sophos Firewall allows for remote code execution.,2022-09-23,Apply updates per vendor instructions.,2022-10-14,TRUE,0.92841,0.99765,2026-04-20,0.92841,0.99767,2026-04-23,NA,NA,NA,0
CVE-2010-1297,Adobe,Flash Player,Adobe Flash Player Memory Corruption Vulnerability,Adobe Flash Player contains a memory corruption vulnerability that allows remote attackers to execute code or cause denial-of-service (DoS).,2022-06-08,The impacted product is end-of-life and should be disconnected if still in use.,2022-06-22,TRUE,0.92986,0.9978,2026-04-20,0.92838,0.99767,2026-04-23,NA,NA,NA,-0.0015
CVE-2025-64446,Fortinet,FortiWeb,Fortinet FortiWeb Path Traversal Vulnerability,Fortinet FortiWeb contains a relative path traversal vulnerability that may allow an unauthenticated attacker to execute administrative commands on the system via crafted HTTP or HTTPS requests.,2025-11-14,"Apply mitigations per vendor instructions, follow applicable BOD 22-01 guidance for cloud services, or discontinue use of the product if mitigations are unavailable.",2025-11-21,TRUE,0.93115,0.99795,2026-04-20,0.92825,0.99766,2026-04-23,NA,NA,NA,-0.0029
CVE-2023-22952,SugarCRM,Multiple Products,Multiple SugarCRM Products Remote Code Execution Vulnerability,"Multiple SugarCRM products contain a remote code execution vulnerability in the EmailTemplates. Using a specially crafted request, custom PHP code can be injected through the EmailTemplates.",2023-02-02,Apply updates per vendor instructions.,2023-02-23,TRUE,0.92822,0.99763,2026-04-20,0.92822,0.99765,2026-04-23,NA,NA,NA,0
CVE-2022-30333,RARLAB,UnRAR,RARLAB UnRAR Directory Traversal Vulnerability,"RARLAB UnRAR on Linux and UNIX contains a directory traversal vulnerability, allowing an attacker to write to files during an extract (unpack) operation.",2022-08-09,Apply updates per vendor instructions.,2022-08-30,TRUE,0.92811,0.99763,2026-04-20,0.92811,0.99765,2026-04-23,NA,NA,NA,0
CVE-2015-5122,Adobe,Flash Player,Adobe Flash Player Use-After-Free Vulnerability,Use-after-free vulnerability in the DisplayObject class in the ActionScript 3 (AS3) implementation in Adobe Flash Player allows remote attackers to execute code or cause a denial-of-service (DoS).,2022-04-13,The impacted product is end-of-life and should be disconnected if still in use.,2022-05-04,TRUE,0.9278,0.9976,2026-04-20,0.9278,0.99763,2026-04-23,NA,NA,NA,0
