cve,vendor_project,product,vulnerability_name,short_description,date_added,required_action,due_date,in_wild,initial_epss,initial_percentile,initial_date,current_epss,current_percentile,current_date,cvss_v3_base,cvss_v3_severity,cvss_v2_base,epss_delta
CVE-2024-37085,VMware,ESXi,VMware ESXi Authentication Bypass Vulnerability,VMware ESXi contains an authentication bypass vulnerability. A malicious actor with sufficient Active Directory (AD) permissions can gain full access to an ESXi host that was previously configured to use AD for user management by re-creating the configured AD group ('ESXi Admins' by default) after it was deleted from AD.,2024-07-30,Apply mitigations per vendor instructions or discontinue use of the product if mitigations are unavailable.,2024-08-20,TRUE,0.71917,0.98745,2026-04-20,0.71917,0.9875,2026-04-23,6.8,MEDIUM,NA,0
CVE-2020-13965,Roundcube,Webmail,Roundcube Webmail Cross-Site Scripting (XSS) Vulnerability,Roundcube Webmail contains a cross-site scripting (XSS) vulnerability that allows a remote attacker to manipulate data via a malicious XML attachment.,2024-06-26,Apply mitigations per vendor instructions or discontinue use of the product if mitigations are unavailable.,2024-07-17,TRUE,0.71819,0.98741,2026-04-20,0.71819,0.98746,2026-04-23,NA,NA,NA,0
CVE-2020-8195,Citrix,"Application Delivery Controller (ADC), Gateway, and SD-WAN WANOP Appliance","Citrix ADC, Gateway, and SD-WAN WANOP Appliance Information Disclosure Vulnerability","Citrix ADC, Citrix Gateway, and multiple Citrix SD-WAN WANOP appliance models contain an information disclosure vulnerability.",2021-11-03,Apply updates per vendor instructions.,2022-05-03,TRUE,0.71723,0.98737,2026-04-20,0.71723,0.98742,2026-04-23,NA,NA,NA,0
CVE-2025-34026,Versa,Concerto,Versa Concerto Improper Authentication Vulnerability,"Versa Concerto SD-WAN orchestration platform contains an improper authentication vulnerability in the Traefik reverse proxy configuration, allowing at attacker to access administrative endpoints. The internal Actuator endpoint can be leveraged for access to heap dumps and trace logs.",2026-01-22,"Apply mitigations per vendor instructions, follow applicable BOD 22-01 guidance for cloud services, or discontinue use of the product if mitigations are unavailable.",2026-02-12,TRUE,0.71578,0.98733,2026-04-20,0.71578,0.98739,2026-04-23,NA,NA,NA,0
CVE-2015-4495,Mozilla,Firefox,Mozilla Firefox Security Feature Bypass Vulnerability,Moxilla Firefox allows remote attackers to bypass the Same Origin Policy to read arbitrary files or gain privileges.,2022-05-25,Apply updates per vendor instructions.,2022-06-15,TRUE,0.71568,0.98732,2026-04-20,0.71568,0.98738,2026-04-23,NA,NA,NA,0
CVE-2025-49706,Microsoft,SharePoint,Microsoft SharePoint Improper Authentication Vulnerability,"Microsoft SharePoint contains an improper authentication vulnerability that allows an authorized attacker to perform spoofing over a network. Successfully exploitation could allow an attacker to view sensitive information and make some changes to disclosed information. This vulnerability could be chained with CVE-2025-49704. CVE-2025-53771 is a patch bypass for CVE-2025-49706, and the updates for CVE-2025-53771 include more robust protection than those for CVE-2025-49706.",2025-07-22,"Disconnect public-facing versions of SharePoint Server that have reached their end-of-life (EOL) or end-of-service (EOS) to include SharePoint Server 2013 and earlier versions. For supported versions, please follow the mitigations according to CISA (URL listed below in Notes) and vendor instructions (URL listed below in Notes). Adhere to the applicable BOD 22-01 guidance for cloud services or discontinue use of the product if mitigations are not available.",2025-07-23,TRUE,0.71567,0.98732,2026-04-20,0.71567,0.98738,2026-04-23,NA,NA,NA,0
CVE-2023-36874,Microsoft,Windows,Microsoft Windows Error Reporting Service Privilege Escalation Vulnerability,Microsoft Windows Error Reporting Service contains an unspecified vulnerability that allows for privilege escalation.,2023-07-11,Apply updates per vendor instructions or discontinue use of the product if updates are unavailable.,2023-08-01,TRUE,0.71153,0.98713,2026-04-20,0.71559,0.98737,2026-04-23,7.8,HIGH,NA,0.0041
CVE-2019-13608,Citrix,StoreFront Server,Citrix StoreFront Server XML External Entity (XXE) Processing Vulnerability,Citrix StoreFront Server contains an XML External Entity (XXE) processing vulnerability that may allow an unauthenticated attacker to retrieve potentially sensitive information.,2021-11-03,Apply updates per vendor instructions.,2022-05-03,TRUE,0.71255,0.98717,2026-04-20,0.71255,0.98723,2026-04-23,NA,NA,NA,0
CVE-2021-22175,GitLab,GitLab,GitLab Server-Side Request Forgery (SSRF) Vulnerability,GitLab contains a server-side request forgery (SSRF) vulnerability when requests to the internal network for webhooks are enabled.,2026-02-18,"Apply mitigations per vendor instructions, follow applicable BOD 22-01 guidance for cloud services, or discontinue use of the product if mitigations are unavailable.",2026-03-11,TRUE,0.76649,0.9895,2026-04-20,0.71157,0.9872,2026-04-23,NA,NA,NA,-0.0549
CVE-2020-36193,PEAR,Archive_Tar,PEAR Archive_Tar Improper Link Resolution Vulnerability,PEAR Archive_Tar Tar.php allows write operations with directory traversal due to inadequate checking of symbolic links. PEAR stands for PHP Extension and Application Repository and it is an open-source framework and distribution system for reusable PHP components with known usage in third-party products such as Drupal Core and Red Hat Linux.,2022-08-25,Apply updates per vendor instructions.,2022-09-15,TRUE,0.71148,0.98713,2026-04-20,0.71148,0.98719,2026-04-23,NA,NA,NA,0
CVE-2021-30860,Apple,Multiple Products,Apple Multiple Products Integer Overflow Vulnerability,"Apple iOS, iPadOS, macOS, and watchOS CoreGraphics contain an integer overflow vulnerability which may allow code execution when processing a maliciously crafted PDF. The vulnerability is also known under the moniker of FORCEDENTRY.",2021-11-03,Apply updates per vendor instructions.,2021-11-17,TRUE,0.70642,0.98698,2026-04-20,0.71055,0.98714,2026-04-23,NA,NA,NA,0.0041
CVE-2021-33742,Microsoft,Windows,Microsoft Windows MSHTML Platform Remote Code Execution Vulnerability,Microsoft Windows MSHTML Platform contains an unspecified vulnerability that allows for remote code execution.,2021-11-03,Apply updates per vendor instructions.,2021-11-17,TRUE,0.71001,0.98706,2026-04-20,0.71001,0.98713,2026-04-23,NA,NA,NA,0
CVE-2024-7399,Samsung,MagicINFO 9 Server,Samsung MagicINFO 9 Server Path Traversal Vulnerability,Samsung MagicINFO 9 Server contains a path traversal vulnerability that could allow an attacker to write arbitrary files as system authority.,2026-04-24,"Apply mitigations per vendor instructions, follow applicable BOD 22-01 guidance for cloud services, or discontinue use of the product if mitigations are unavailable.",2026-05-08,TRUE,0.70996,0.98706,2026-04-20,0.70996,0.98712,2026-04-23,8.8,HIGH,NA,0
CVE-2008-0655,Adobe,Acrobat and Reader,Adobe Acrobat and Reader Unspecified Vulnerability,Adobe Acrobat and Reader contains an unespecified vulnerability described as a design flaw which could allow a specially crafted file to be printed silently an arbitrary number of times.,2022-06-08,Apply updates per vendor instructions.,2022-06-22,TRUE,0.68768,0.98628,2026-04-20,0.70847,0.98708,2026-04-23,NA,NA,NA,0.0208
CVE-2013-3660,Microsoft,Win32k,Microsoft Win32k Privilege Escalation Vulnerability,"The EPATHOBJ::pprFlattenRec function in win32k.sys in the kernel-mode drivers in Microsoft does not properly initialize a pointer for the next object in a certain list, which allows local users to gain privileges.",2022-03-28,Apply updates per vendor instructions.,2022-04-18,TRUE,0.69169,0.98645,2026-04-20,0.70632,0.98703,2026-04-23,NA,NA,NA,0.0146
CVE-2014-2120,Cisco,Adaptive Security Appliance (ASA),Cisco Adaptive Security Appliance (ASA) Cross-Site Scripting (XSS) Vulnerability,Cisco Adaptive Security Appliance (ASA) contains a cross-site scripting (XSS) vulnerability in the WebVPN login page. This vulnerability allows remote attackers to inject arbitrary web script or HTML via an unspecified parameter.,2024-11-12,Apply mitigations per vendor instructions or discontinue use of the product if mitigations are unavailable.,2024-12-03,TRUE,0.6387,0.98432,2026-04-20,0.69838,0.98676,2026-04-23,6.1,MEDIUM,4.3,0.0597
CVE-2024-21287,Oracle,Agile Product Lifecycle Management (PLM),Oracle Agile Product Lifecycle Management (PLM) Incorrect Authorization Vulnerability,Oracle Agile Product Lifecycle Management (PLM) contains an incorrect authorization vulnerability in the Process Extension component of the Software Development Kit. Successful exploitation of this vulnerability may result in unauthenticated file disclosure.,2024-11-21,Apply mitigations per vendor instructions or discontinue use of the product if mitigations are unavailable.,2024-12-12,TRUE,0.69826,0.98671,2026-04-20,0.69826,0.98676,2026-04-23,NA,NA,NA,0
CVE-2022-37055,D-Link,Routers,D-Link Routers Buffer Overflow Vulnerability,"D-Link Routers contains a buffer overflow vulnerability that has a high impact on confidentiality, integrity, and availability. The impacted products could be end-of-life (EoL) and/or end-of-service (EoS). Users should discontinue product utilization.",2025-12-08,"Apply mitigations per vendor instructions, follow applicable BOD 22-01 guidance for cloud services, or discontinue use of the product if mitigations are unavailable.",2025-12-29,TRUE,0.69755,0.98669,2026-04-20,0.69755,0.98674,2026-04-23,NA,NA,NA,0
CVE-2020-3259,Cisco,Adaptive Security Appliance (ASA) and Firepower Threat Defense (FTD),Cisco ASA and FTD Information Disclosure Vulnerability,"Cisco Adaptive Security Appliance (ASA) and Firepower Threat Defense (FTD) contain an information disclosure vulnerability. An attacker could retrieve memory contents on an affected device, which could lead to the disclosure of confidential information due to a buffer tracking issue when the software parses invalid URLs that are requested from the web services interface. This vulnerability affects only specific AnyConnect and WebVPN configurations.",2024-02-15,Apply mitigations per vendor instructions or discontinue use of the product if mitigations are unavailable.,2024-03-07,TRUE,0.69725,0.98667,2026-04-20,0.69725,0.98672,2026-04-23,NA,NA,NA,0
CVE-2025-2775,SysAid,SysAid On-Prem,SysAid On-Prem Improper Restriction of XML External Entity Reference Vulnerability,"SysAid On-Prem contains an improper restriction of XML external entity reference vulnerability in the Checkin processing functionality, allowing for administrator account takeover and file read primitives.",2025-07-22,"Apply mitigations per vendor instructions, follow applicable BOD 22-01 guidance for cloud services, or discontinue use of the product if mitigations are unavailable.",2025-08-12,TRUE,0.69265,0.98651,2026-04-20,0.69265,0.98656,2026-04-23,9.3,CRITICAL,NA,0
CVE-2025-9242,WatchGuard,Firebox,WatchGuard Firebox Out-of-Bounds Write Vulnerability,WatchGuard Firebox contains an out-of-bounds write vulnerability in the OS iked process that may allow a remote unauthenticated attacker to execute arbitrary code.,2025-11-12,"Apply mitigations per vendor instructions, follow applicable BOD 22-01 guidance for cloud services, or discontinue use of the product if mitigations are unavailable.",2025-12-03,TRUE,0.68973,0.98638,2026-04-20,0.68973,0.98644,2026-04-23,NA,NA,NA,0
CVE-2025-40536,SolarWinds,Web Help Desk,SolarWinds Web Help Desk Security Control Bypass Vulnerability,SolarWinds Web Help Desk contains a security control bypass vulnerability that could allow an unauthenticated attacker to gain access to certain restricted functionality.,2026-02-12,"Apply mitigations per vendor instructions, follow applicable BOD 22-01 guidance for cloud services, or discontinue use of the product if mitigations are unavailable.",2026-02-15,TRUE,0.71251,0.98717,2026-04-20,0.68905,0.9864,2026-04-23,NA,NA,NA,-0.0235
CVE-2014-3153,Linux,Kernel,Linux Kernel Privilege Escalation Vulnerability,"The futex_requeue function in kernel/futex.c in Linux kernel does not ensure that calls have two different futex addresses, which allows local users to gain privileges.",2022-05-25,Apply updates per vendor instructions.,2022-06-15,TRUE,0.68892,0.98635,2026-04-20,0.68892,0.9864,2026-04-23,NA,NA,NA,0
CVE-2025-27363,FreeType,FreeType,FreeType Out-of-Bounds Write Vulnerability,FreeType contains an out-of-bounds write vulnerability when attempting to parse font subglyph structures related to TrueType GX and variable font files that may allow for arbitrary code execution.,2025-05-06,"Apply mitigations per vendor instructions, follow applicable BOD 22-01 guidance for cloud services, or discontinue use of the product if mitigations are unavailable.",2025-05-27,TRUE,0.70312,0.98686,2026-04-20,0.68721,0.98631,2026-04-23,NA,NA,NA,-0.0159
CVE-2019-11708,Mozilla,Firefox and Thunderbird,Mozilla Firefox and Thunderbird Sandbox Escape Vulnerability,Mozilla Firefox and Thunderbird contain a sandbox escape vulnerability that could result in remote code execution.,2022-05-23,Apply updates per vendor instructions.,2022-06-13,TRUE,0.6844,0.98616,2026-04-20,0.6844,0.98621,2026-04-23,10,CRITICAL,10,0
CVE-2025-54236,Adobe,Commerce and Magento,Adobe Commerce and Magento Improper Input Validation Vulnerability,Adobe Commerce and Magento Open Source contain an improper input validation vulnerability that could allow an attacker to take over customer accounts through the Commerce REST API.,2025-10-24,"Apply mitigations per vendor instructions, follow applicable BOD 22-01 guidance for cloud services, or discontinue use of the product if mitigations are unavailable.",2025-11-14,TRUE,0.70101,0.98677,2026-04-20,0.68381,0.98617,2026-04-23,NA,NA,NA,-0.0172
CVE-2021-38003,Google,Chromium V8,Google Chromium V8 Memory Corruption Vulnerability,"Google Chromium V8 Engine has a bug in JSON.stringify, where the internal TheHole value can leak to script code, causing memory corruption. This vulnerability could affect multiple web browsers that utilize Chromium, including, but not limited to, Google Chrome, Microsoft Edge, and Opera.",2021-11-03,Apply updates per vendor instructions.,2021-11-17,TRUE,0.68262,0.98609,2026-04-20,0.68262,0.98612,2026-04-23,8.8,HIGH,6.8,0
CVE-2024-40711,Veeam,Backup & Replication,Veeam Backup and Replication Deserialization Vulnerability,Veeam Backup and Replication contains a deserialization vulnerability allowing an unauthenticated user to perform remote code execution.,2024-10-17,Apply mitigations per vendor instructions or discontinue use of the product if mitigations are unavailable.,2024-11-07,TRUE,0.68197,0.98606,2026-04-20,0.68197,0.98609,2026-04-23,9.8,CRITICAL,NA,0
CVE-2020-8196,Citrix,"Application Delivery Controller (ADC), Gateway, and SD-WAN WANOP Appliance","Citrix ADC, Gateway, and SD-WAN WANOP Appliance Information Disclosure Vulnerability","Citrix ADC, Citrix Gateway, and multiple Citrix SD-WAN WANOP appliance models contain an information disclosure vulnerability.",2021-11-03,Apply updates per vendor instructions.,2022-05-03,TRUE,0.68113,0.98602,2026-04-20,0.68113,0.98606,2026-04-23,NA,NA,NA,0
CVE-2009-0556,Microsoft,Office,Microsoft Office PowerPoint Code Injection Vulnerability,Microsoft Office PowerPoint contains a code injection vulnerability that allows remote attackers to execute arbitrary code via a PowerPoint file with an OutlineTextRefAtom containing an invalid index value that triggers memory corruption.,2026-01-07,"Apply mitigations per vendor instructions, follow applicable BOD 22-01 guidance for cloud services, or discontinue use of the product if mitigations are unavailable.",2026-01-28,TRUE,0.76447,0.9894,2026-04-20,0.67884,0.98596,2026-04-23,NA,NA,NA,-0.0856
CVE-2016-2388,SAP,NetWeaver,SAP NetWeaver Information Disclosure Vulnerability,The Universal Worklist Configuration in SAP NetWeaver AS JAVA 7.4 allows remote attackers to obtain sensitive user information via a crafted HTTP request.,2022-06-09,Apply updates per vendor instructions.,2022-06-30,TRUE,0.62285,0.98366,2026-04-20,0.67754,0.98591,2026-04-23,NA,NA,NA,0.0547
CVE-2013-6282,Linux,Kernel,Linux Kernel Improper Input Validation Vulnerability,The get_user and put_user API functions of the Linux kernel fail to validate the target address when being used on ARM v6k/v7 platforms. This allows an application to read and write kernel memory which could lead to privilege escalation.,2022-09-15,Apply updates per vendor instructions.,2022-10-06,TRUE,0.6765,0.98584,2026-04-20,0.6765,0.98587,2026-04-23,8.8,HIGH,7.2,0
CVE-2025-11371,Gladinet,CentreStack and Triofox,Gladinet CentreStack and Triofox Files or Directories Accessible to External Parties Vulnerability,Gladinet CentreStack and Triofox contains a files or directories accessible to external parties vulnerability that allows unintended disclosure of system files.,2025-11-04,"Apply mitigations per vendor instructions, follow applicable BOD 22-01 guidance for cloud services, or discontinue use of the product if mitigations are unavailable.",2025-11-25,TRUE,0.67647,0.98584,2026-04-20,0.67647,0.98587,2026-04-23,7.5,HIGH,NA,0
CVE-2010-1428,Red Hat,JBoss,Red Hat JBoss Information Disclosure Vulnerability,"Unauthenticated access to the JBoss Application Server Web Console (/web-console) is blocked by default. However, it was found that this block was incomplete, and only blocked GET and POST HTTP verbs. A remote attacker could use this flaw to gain access to sensitive information.",2022-05-25,Apply updates per vendor instructions.,2022-06-15,TRUE,0.67611,0.98583,2026-04-20,0.67611,0.98586,2026-04-23,7.5,HIGH,5,0
CVE-2021-38406,Delta Electronics,DOPSoft 2,Delta Electronics DOPSoft 2 Improper Input Validation Vulnerability,Delta Electronics DOPSoft 2 lacks proper validation of user-supplied data when parsing specific project files (improper input validation) resulting in an out-of-bounds write that allows for code execution.,2022-08-25,The impacted product is end-of-life and should be disconnected if still in use.,2022-09-15,TRUE,0.675,0.9858,2026-04-20,0.675,0.98584,2026-04-23,NA,NA,NA,0
CVE-2016-0984,Adobe,Flash Player and AIR,Adobe Flash Player and AIR Use-After-Free Vulnerability,Use-after-free vulnerability in Adobe Flash Player and Adobe AIR allows attackers to execute code.,2022-05-25,The impacted products are end-of-life and should be disconnected if still in use.,2022-06-15,TRUE,0.75907,0.98918,2026-04-20,0.67422,0.98579,2026-04-23,NA,NA,NA,-0.0848
CVE-2024-20953,Oracle,Agile Product Lifecycle Management (PLM),Oracle Agile Product Lifecycle Management (PLM) Deserialization Vulnerability,Oracle Agile Product Lifecycle Management (PLM) contains a deserialization vulnerability that allows a low-privileged attacker with network access via HTTP to compromise the system.,2025-02-24,Apply mitigations per vendor instructions or discontinue use of the product if mitigations are unavailable.,2025-03-17,TRUE,0.67415,0.98575,2026-04-20,0.67415,0.98578,2026-04-23,8.8,HIGH,NA,0
CVE-2023-4911,GNU,GNU C Library,GNU C Library Buffer Overflow Vulnerability,"GNU C Library's dynamic loader ld.so contains a buffer overflow vulnerability when processing the GLIBC_TUNABLES environment variable, allowing a local attacker to execute code with elevated privileges.",2023-11-21,Apply mitigations per vendor instructions or discontinue use of the product if mitigations are unavailable.,2023-12-12,TRUE,0.74256,0.98847,2026-04-20,0.67392,0.98577,2026-04-23,NA,NA,NA,-0.0686
CVE-2022-44698,Microsoft,Defender,Microsoft Defender SmartScreen Security Feature Bypass Vulnerability,Microsoft Defender SmartScreen contains a security feature bypass vulnerability that could allow an attacker to evade Mark of the Web (MOTW) defenses via a specially crafted malicious file.,2022-12-13,Apply updates per vendor instructions.,2023-01-03,TRUE,0.67219,0.98568,2026-04-20,0.67219,0.98571,2026-04-23,NA,NA,NA,0
CVE-2011-2005,Microsoft,Ancillary Function Driver (afd.sys),Microsoft Ancillary Function Driver (afd.sys) Improper Input Validation Vulnerability,"afd.sys in the Ancillary Function Driver in Microsoft Windows does not properly validate user-mode input passed to kernel mode, which allows local users to gain privileges via a crafted application.",2022-03-28,Apply updates per vendor instructions.,2022-04-18,TRUE,0.67089,0.98562,2026-04-20,0.67089,0.98565,2026-04-23,7.8,HIGH,7.2,0
CVE-2016-1646,Google,Chromium V8,Google Chromium V8 Out-of-Bounds Read Vulnerability,"Google Chromium V8 Engine contains an out-of-bounds read vulnerability that allows a remote attacker to cause a denial of service or possibly have another unspecified impact via crafted JavaScript code. This vulnerability could affect multiple web browsers that utilize Chromium, including, but not limited to, Google Chrome, Microsoft Edge, and Opera.",2022-06-08,Apply updates per vendor instructions.,2022-06-22,TRUE,0.66511,0.98539,2026-04-20,0.66909,0.98559,2026-04-23,NA,NA,NA,0.004
CVE-2026-1340,Ivanti,Endpoint Manager Mobile (EPMM),Ivanti Endpoint Manager Mobile (EPMM) Code Injection Vulnerability,Ivanti Endpoint Manager Mobile (EPMM) contains a code injection vulnerability that could allow attackers to achieve unauthenticated remote code execution.,2026-04-08,"Apply mitigations per vendor instructions, follow applicable BOD 22-01 guidance for cloud services, or discontinue use of the product if mitigations are unavailable.",2026-04-11,TRUE,0.75816,0.98913,2026-04-20,0.66857,0.98559,2026-04-23,NA,NA,NA,-0.0896
CVE-2016-4656,Apple,iOS,Apple iOS Memory Corruption Vulnerability,A memory corruption vulnerability in Apple iOS kernel allows attackers to execute code in a privileged context or cause a denial-of-service (DoS) via a crafted application.,2022-05-24,Apply updates per vendor instructions.,2022-06-14,TRUE,0.66743,0.98548,2026-04-20,0.66743,0.98552,2026-04-23,NA,NA,NA,0
CVE-2022-26501,Veeam,Backup & Replication,Veeam Backup & Replication Remote Code Execution Vulnerability,The Veeam Distribution Service in the Backup & Replication application allows unauthenticated users to access internal API functions. A remote attacker can send input to the internal API which may lead to uploading and executing of malicious code.,2022-12-13,Apply updates per vendor instructions.,2023-01-03,TRUE,0.66731,0.98548,2026-04-20,0.66731,0.98552,2026-04-23,NA,NA,NA,0
CVE-2025-5777,Citrix,NetScaler ADC and Gateway,Citrix NetScaler ADC and Gateway Out-of-Bounds Read Vulnerability,"Citrix NetScaler ADC and Gateway contain an out-of-bounds read vulnerability due to insufficient input validation. This vulnerability can lead to memory overread when the NetScaler is configured as a Gateway (VPN virtual server, ICA Proxy, CVPN, RDP Proxy) OR AAA virtual server.",2025-07-10,"Apply mitigations per vendor instructions, follow applicable BOD 22-01 guidance for cloud services, or discontinue use of the product if mitigations are unavailable.",2025-07-11,TRUE,0.66667,0.98544,2026-04-20,0.66667,0.98549,2026-04-23,NA,NA,NA,0
CVE-2014-0496,Adobe,Reader and Acrobat,Adobe Reader and Acrobat Use-After-Free Vulnerability,Adobe Reader and Acrobat contain a use-after-free vulnerability which can allow for code execution.,2022-03-03,Apply updates per vendor instructions.,2022-03-24,TRUE,0.7468,0.98863,2026-04-20,0.66247,0.98535,2026-04-23,NA,NA,NA,-0.0843
CVE-2024-11120,GeoVision,Multiple Devices,GeoVision Devices OS Command Injection Vulnerability,"Multiple GeoVision devices contain an OS command injection vulnerability that allows a remote, unauthenticated attacker to inject and execute arbitrary system commands. The impacted products could be end-of-life (EoL) and/or end-of-service (EoS). Users should discontinue product utilization.",2025-05-07,"Apply mitigations per vendor instructions, follow applicable BOD 22-01 guidance for cloud services, or discontinue use of the product if mitigations are unavailable.",2025-05-28,TRUE,0.66138,0.98525,2026-04-20,0.66138,0.9853,2026-04-23,NA,NA,NA,0
CVE-2013-2094,Linux,Kernel,Linux Kernel Privilege Escalation Vulnerability,"Linux kernel fails to check all 64 bits of attr.config passed by user space, resulting to out-of-bounds access of the perf_swevent_enabled array in sw_perf_event_destroy(). Explotation allows for privilege escalation.",2022-09-15,Apply updates per vendor instructions.,2022-10-06,TRUE,0.65851,0.98513,2026-04-20,0.65851,0.98518,2026-04-23,NA,NA,NA,0
CVE-2016-4523,Trihedral,VTScada (formerly VTS),Trihedral VTScada (formerly VTS) Denial-of-Service Vulnerability,The WAP interface in Trihedral VTScada (formerly VTS) allows remote attackers to cause a denial-of-service (DoS).,2022-04-15,Apply updates per vendor instructions.,2022-05-06,TRUE,0.66951,0.98557,2026-04-20,0.65426,0.985,2026-04-23,7.5,HIGH,5,-0.0153
CVE-2017-0262,Microsoft,Office,Microsoft Office Remote Code Execution Vulnerability,A remote code execution vulnerability exists in Microsoft Office.,2022-02-10,Apply updates per vendor instructions.,2022-08-10,TRUE,0.64256,0.98449,2026-04-20,0.64998,0.98483,2026-04-23,NA,NA,NA,0.0074
CVE-2020-35730,Roundcube,Roundcube Webmail,Roundcube Webmail Cross-Site Scripting (XSS) Vulnerability,Roundcube Webmail contains a cross-site scripting (XSS) vulnerability that allows an attacker to send a plain text e-mail message with Javascript in a link reference element that is mishandled by linkref_addinindex in rcube_string_replacer.php.,2023-06-22,Apply updates per vendor instructions.,2023-07-13,TRUE,0.64813,0.98471,2026-04-20,0.64813,0.98476,2026-04-23,NA,NA,NA,0
