cve,vendor_project,product,vulnerability_name,short_description,date_added,required_action,due_date,in_wild,initial_epss,initial_percentile,initial_date,current_epss,current_percentile,current_date,cvss_v3_base,cvss_v3_severity,cvss_v2_base,epss_delta
CVE-2023-23752,Joomla!,Joomla!,Joomla! Improper Access Control Vulnerability,Joomla! contains an improper access control vulnerability that allows unauthorized access to webservice endpoints.,2024-01-08,Apply mitigations per vendor instructions or discontinue use of the product if mitigations are unavailable.,2024-01-29,TRUE,0.94511,1,2026-04-20,0.9452,1,2026-04-23,NA,NA,NA,1e-4
CVE-2018-7600,Drupal,Drupal Core,Drupal Core Remote Code Execution Vulnerability,"Drupal Core contains a remote code execution vulnerability that could allow an attacker to exploit multiple attack vectors on a Drupal site, resulting in complete site compromise.",2021-11-03,Apply updates per vendor instructions.,2022-05-03,TRUE,0.94489,1,2026-04-20,0.94489,1,2026-04-23,NA,NA,NA,0
CVE-2018-1000861,Jenkins,Jenkins Stapler Web Framework,Jenkins Stapler Web Framework Deserialization of Untrusted Data Vulnerability,A code execution vulnerability exists in the Stapler web framework used by Jenkins,2022-02-10,Apply updates per vendor instructions.,2022-08-10,TRUE,0.94485,0.99999,2026-04-20,0.94485,1,2026-04-23,NA,NA,NA,0
CVE-2021-22986,F5,BIG-IP and BIG-IQ Centralized Management,F5 BIG-IP and BIG-IQ Centralized Management iControl REST Remote Code Execution Vulnerability,"F5 BIG-IP and BIG-IQ Centralized Management contain a remote code execution vulnerability in the iControl REST interface that allows unauthenticated attackers with network access to execute system commands, create or delete files, and disable services.",2021-11-03,Apply updates per vendor instructions.,2021-11-17,TRUE,0.94485,0.99999,2026-04-20,0.94485,0.99999,2026-04-23,NA,NA,NA,0
CVE-2019-0708,Microsoft,Remote Desktop Services,Microsoft Remote Desktop Services Remote Code Execution Vulnerability,"Microsoft Remote Desktop Services, formerly known as Terminal Service, contains an unspecified vulnerability that allows an unauthenticated attacker to connect to the target system using RDP and send specially crafted requests. Successful exploitation allows for remote code execution. The vulnerability is also known under the moniker of BlueKeep.",2021-11-03,Apply updates per vendor instructions.,2022-05-03,TRUE,0.94454,0.99992,2026-04-20,0.94483,0.99999,2026-04-23,9.8,CRITICAL,10,3e-4
CVE-2017-1000353,Jenkins,Jenkins,Jenkins Remote Code Execution Vulnerability,"Jenkins contains a remote code execution vulnerability. This vulnerability that could allowed attackers to transfer a serialized Java SignedObject object to the remoting-based Jenkins CLI, that would be deserialized using a new ObjectInputStream, bypassing the existing blocklist-based protection mechanism.",2025-10-02,"Apply mitigations per vendor instructions, follow applicable BOD 22-01 guidance for cloud services, or discontinue use of the product if mitigations are unavailable.",2025-10-23,TRUE,0.94493,1,2026-04-20,0.94482,0.99999,2026-04-23,NA,NA,NA,-1e-4
CVE-2019-3396,Atlassian,Confluence Server and Data Server,Atlassian Confluence Server and Data Center Server-Side Template Injection Vulnerability,Atlassian Confluence Server and Data Center contain a server-side template injection vulnerability that may allow an attacker to achieve path traversal and remote code execution.,2021-11-03,Apply updates per vendor instructions.,2022-05-03,TRUE,0.94471,0.99998,2026-04-20,0.94471,0.99998,2026-04-23,NA,NA,NA,0
CVE-2019-17558,Apache,Solr,Apache Solr VelocityResponseWriter Plug-In Remote Code Execution Vulnerability,The Apache Solr VelocityResponseWriter plug-in contains an unspecified vulnerability which can allow for remote code execution.,2021-11-03,Apply updates per vendor instructions.,2022-05-03,TRUE,0.9447,0.99998,2026-04-20,0.9447,0.99998,2026-04-23,NA,NA,NA,0
CVE-2022-46169,Cacti,Cacti,Cacti Command Injection Vulnerability,Cacti contains a command injection vulnerability that allows an unauthenticated user to execute code.,2023-02-16,Apply updates per vendor instructions.,2023-03-09,TRUE,0.94469,0.99998,2026-04-20,0.94469,0.99998,2026-04-23,NA,NA,NA,0
CVE-2020-1938,Apache,Tomcat,Apache Tomcat Improper Privilege Management Vulnerability,"Apache Tomcat treats Apache JServ Protocol (AJP) connections as having higher trust than, for example, a similar HTTP connection. If such connections are available to an attacker, they can be exploited.",2022-03-03,Apply updates per vendor instructions.,2022-03-17,TRUE,0.94469,0.99997,2026-04-20,0.94469,0.99997,2026-04-23,NA,NA,NA,0
CVE-2024-6670,Progress,WhatsUp Gold,Progress WhatsUp Gold SQL Injection Vulnerability,Progress WhatsUp Gold contains a SQL injection vulnerability that allows an unauthenticated attacker to retrieve the user's encrypted password if the application is configured with only a single user.,2024-09-16,Apply mitigations per vendor instructions or discontinue use of the product if mitigations are unavailable.,2024-10-07,TRUE,0.94468,0.99997,2026-04-20,0.94468,0.99997,2026-04-23,NA,NA,NA,0
CVE-2019-2725,Oracle,WebLogic Server,"Oracle WebLogic Server, Injection",Injection vulnerability in the Oracle WebLogic Server component of Oracle Fusion Middleware (subcomponent: Web Services).,2022-01-10,Apply updates per vendor instructions.,2022-07-10,TRUE,0.94468,0.99997,2026-04-20,0.94468,0.99997,2026-04-23,NA,NA,NA,0
CVE-2021-22205,GitLab,Community and Enterprise Editions,GitLab Community and Enterprise Editions Remote Code Execution Vulnerability,"GitHub Community and Enterprise Editions that utilize the ability to upload images through GitLab Workhorse are vulnerable to remote code execution. Workhorse passes image file extensions through ExifTool, which improperly validates the image files.",2021-11-03,Apply updates per vendor instructions.,2021-11-17,TRUE,0.94467,0.99996,2026-04-20,0.94467,0.99997,2026-04-23,10,CRITICAL,7.5,0
CVE-2024-23897,Jenkins,Jenkins Command Line Interface (CLI),Jenkins Command Line Interface (CLI) Path Traversal Vulnerability,"Jenkins Command Line Interface (CLI) contains a path traversal vulnerability that allows attackers limited read access to certain files, which can lead to code execution.",2024-08-19,Apply mitigations per vendor instructions or discontinue use of the product if mitigations are unavailable.,2024-09-09,TRUE,0.94466,0.99996,2026-04-20,0.94466,0.99996,2026-04-23,NA,NA,NA,0
CVE-2016-10033,PHP,PHPMailer,PHPMailer Command Injection Vulnerability,"PHPMailer contains a command injection vulnerability because it fails to sanitize user-supplied input. Specifically, this issue affects the 'mail()' function of 'class.phpmailer.php' script. An attacker can exploit this issue to execute arbitrary code within the context of the application. Failed exploit attempts will result in a denial-of-service condition.",2025-07-07,"Apply mitigations per vendor instructions, follow applicable BOD 22-01 guidance for cloud services, or discontinue use of the product if mitigations are unavailable.",2025-07-28,TRUE,0.94465,0.99996,2026-04-20,0.94465,0.99996,2026-04-23,NA,NA,NA,0
CVE-2021-44228,Apache,Log4j2,Apache Log4j2 Remote Code Execution Vulnerability,"Apache Log4j2 contains a vulnerability where JNDI features do not protect against attacker-controlled JNDI-related endpoints, allowing for remote code execution.",2021-12-10,"For all affected software assets for which updates exist, the only acceptable remediation actions are: 1) Apply updates; OR 2) remove affected assets from agency networks. Temporary mitigations using one of the measures provided at https://www.cisa.gov/uscert/ed-22-02-apache-log4j-recommended-mitigation-measures are only acceptable until updates are available.",2021-12-24,TRUE,0.94358,0.99962,2026-04-20,0.94465,0.99996,2026-04-23,NA,NA,NA,0.0011
CVE-2014-0160,OpenSSL,OpenSSL,OpenSSL Information Disclosure Vulnerability,"The TLS and DTLS implementations in OpenSSL do not properly handle Heartbeat Extension packets, which allows remote attackers to obtain sensitive information.",2022-05-04,Apply updates per vendor instructions.,2022-05-25,TRUE,0.94464,0.99995,2026-04-20,0.94464,0.99995,2026-04-23,NA,NA,NA,0
CVE-2019-11510,Ivanti,Pulse Connect Secure,Ivanti Pulse Connect Secure Arbitrary File Read Vulnerability,Ivanti Pulse Connect Secure contains an arbitrary file read vulnerability that allows an unauthenticated remote attacker with network access via HTTPS to send a specially crafted URI.,2021-11-03,Apply updates per vendor instructions.,2022-05-03,TRUE,0.94462,0.99995,2026-04-20,0.94462,0.99995,2026-04-23,10,CRITICAL,7.5,0
CVE-2022-22963,VMware Tanzu,Spring Cloud,VMware Tanzu Spring Cloud Function Remote Code Execution Vulnerability,"When using routing functionality in VMware Tanzu's Spring Cloud Function, it is possible for a user to provide a specially crafted SpEL as a routing-expression that may result in remote code execution and access to local resources.",2022-08-25,Apply updates per vendor instructions.,2022-09-15,TRUE,0.94462,0.99995,2026-04-20,0.94462,0.99995,2026-04-23,NA,NA,NA,0
CVE-2022-22947,VMware,Spring Cloud Gateway,VMware Spring Cloud Gateway Code Injection Vulnerability,"Spring Cloud Gateway applications are vulnerable to a code injection attack when the Gateway Actuator endpoint is enabled, exposed and unsecured.",2022-05-16,Apply updates per vendor instructions.,2022-06-06,TRUE,0.94461,0.99994,2026-04-20,0.94461,0.99994,2026-04-23,10,CRITICAL,6.8,0
CVE-2021-44529,Ivanti,Endpoint Manager Cloud Service Appliance (EPM CSA),Ivanti Endpoint Manager Cloud Service Appliance (EPM CSA) Code Injection Vulnerability ,Ivanti Endpoint Manager Cloud Service Appliance (EPM CSA) contains a code injection vulnerability that allows an unauthenticated user to execute malicious code with limited permissions (nobody).,2024-03-25,Apply mitigations per vendor instructions or discontinue use of the product if mitigations are unavailable.,2024-04-15,TRUE,0.94461,0.99994,2026-04-20,0.94461,0.99994,2026-04-23,NA,NA,NA,0
CVE-2019-15107,Webmin,Webmin,Webmin Command Injection Vulnerability,An issue was discovered in Webmin. The parameter old in password_change.cgi contains a command injection vulnerability.,2022-03-25,Apply updates per vendor instructions.,2022-04-15,TRUE,0.94461,0.99993,2026-04-20,0.94461,0.99994,2026-04-23,NA,NA,NA,0
CVE-2022-44877,CWP,Control Web Panel,CWP Control Web Panel OS Command Injection Vulnerability,CWP Control Web Panel (formerly CentOS Web Panel) contains an OS command injection vulnerability that allows remote attackers to execute commands via shell metacharacters in the login parameter.,2023-01-17,Apply updates per vendor instructions.,2023-02-07,TRUE,0.94457,0.99993,2026-04-20,0.94457,0.99993,2026-04-23,NA,NA,NA,0
CVE-2021-22005,VMware,vCenter Server,VMware vCenter Server File Upload Vulnerability,VMware vCenter Server contains a file upload vulnerability in the Analytics service that allows a user with network access to port 443 to execute code.,2021-11-03,Apply updates per vendor instructions.,2021-11-17,TRUE,0.94457,0.99993,2026-04-20,0.94457,0.99993,2026-04-23,NA,NA,NA,0
CVE-2022-1388,F5,BIG-IP,F5 BIG-IP Missing Authentication Vulnerability,"F5 BIG-IP contains a missing authentication in critical function vulnerability which can allow for remote code execution, creation or deletion of files, or disabling services.",2022-05-10,Apply updates per vendor instructions.,2022-05-31,TRUE,0.94456,0.99993,2026-04-20,0.94456,0.99993,2026-04-23,NA,NA,NA,0
CVE-2018-13379,Fortinet,FortiOS,Fortinet FortiOS SSL VPN Path Traversal Vulnerability,Fortinet FortiOS SSL VPN web portal contains a path traversal vulnerability that may allow an unauthenticated attacker to download FortiOS system files through specially crafted HTTP resource requests.,2021-11-03,Apply updates per vendor instructions.,2022-05-03,TRUE,0.94473,0.99999,2026-04-20,0.94454,0.99992,2026-04-23,NA,NA,NA,-2e-4
CVE-2020-14882,Oracle,WebLogic Server,Oracle WebLogic Server Remote Code Execution Vulnerability,"Oracle WebLogic Server contains an unspecified vulnerability, which is assessed to allow for remote code execution, based on this vulnerability being related to CVE-2020-14750.",2021-11-03,Apply updates per vendor instructions.,2022-05-03,TRUE,0.94454,0.99992,2026-04-20,0.94454,0.99992,2026-04-23,NA,NA,NA,0
CVE-2020-3452,Cisco,Adaptive Security Appliance (ASA) and Firepower Threat Defense (FTD),Cisco ASA and FTD Read-Only Path Traversal Vulnerability,Cisco Adaptive Security Appliance (ASA) and Firepower Threat Defense (FTD) contain an improper input validation vulnerability when HTTP requests process URLs.  An attacker could exploit this vulnerability by sending a crafted HTTP request containing directory traversal character sequences to an affected device. A successful exploit could allow the attacker to view arbitrary files within the web services file system on the targeted device.,2021-11-03,Apply updates per vendor instructions.,2022-05-03,TRUE,0.94452,0.99992,2026-04-20,0.94452,0.99992,2026-04-23,NA,NA,NA,0
CVE-2023-44487,IETF,HTTP/2,HTTP/2 Rapid Reset Attack Vulnerability,HTTP/2 contains a rapid reset vulnerability that allows for a distributed denial-of-service attack (DDoS).,2023-10-10,"Apply mitigations per vendor instructions, follow applicable BOD 22-01 guidance for cloud services, or discontinue use of the product if mitigations are unavailable.",2023-10-31,TRUE,0.94395,0.99975,2026-04-20,0.94446,0.99991,2026-04-23,7.5,HIGH,NA,5e-4
CVE-2022-30525,Zyxel,Multiple Firewalls,Zyxel Multiple Firewalls OS Command Injection Vulnerability,A command injection vulnerability in the CGI program of some Zyxel firewall versions could allow an attacker to modify specific files and then execute some OS commands on a vulnerable device.,2022-05-16,Apply updates per vendor instructions.,2022-06-06,TRUE,0.94445,0.99991,2026-04-20,0.94445,0.99991,2026-04-23,NA,NA,NA,0
CVE-2022-22954,VMware,Workspace ONE Access and Identity Manager,VMware Workspace ONE Access and Identity Manager Server-Side Template Injection Vulnerability,VMware Workspace ONE Access and Identity Manager allow for remote code execution due to server-side template injection.,2022-04-14,Apply updates per vendor instructions.,2022-05-05,TRUE,0.94444,0.99991,2026-04-20,0.94444,0.99991,2026-04-23,NA,NA,NA,0
CVE-2019-19781,Citrix,"Application Delivery Controller (ADC), Gateway, and SD-WAN WANOP Appliance","Citrix ADC, Gateway, and SD-WAN WANOP Appliance Code Execution Vulnerability","Citrix ADC, Citrix Gateway, and multiple Citrix SD-WAN WANOP appliance models contain an unspecified vulnerability that could allow an unauthenticated attacker to perform code execution.",2021-11-03,Apply updates per vendor instructions.,2022-05-03,TRUE,0.94442,0.99991,2026-04-20,0.94442,0.9999,2026-04-23,NA,NA,NA,0
CVE-2023-32315,Ignite Realtime,Openfire,Ignite Realtime Openfire Path Traversal Vulnerability,Ignite Realtime Openfire contains a path traversal vulnerability that allows an unauthenticated attacker to access restricted pages in the Openfire Admin Console reserved for administrative users.,2023-08-24,Apply mitigations per vendor instructions or discontinue use of the product if mitigations are unavailable.,2023-09-14,TRUE,0.94441,0.9999,2026-04-20,0.94441,0.9999,2026-04-23,NA,NA,NA,0
CVE-2019-0604,Microsoft,SharePoint,Microsoft SharePoint Remote Code Execution Vulnerability,Microsoft SharePoint fails to check the source markup of an application package. An attacker who successfully exploits the vulnerability could run remote code in the context of the SharePoint application pool and the SharePoint server farm account.,2021-11-03,Apply updates per vendor instructions.,2022-05-03,TRUE,0.94441,0.9999,2026-04-20,0.94441,0.9999,2026-04-23,NA,NA,NA,0
CVE-2021-26084,Atlassian,Confluence Server and Data Center,Atlassian Confluence Server and Data Center Object-Graph Navigation Language (OGNL) Injection Vulnerability,Atlassian Confluence Server and Data Server contain an Object-Graph Navigation Language (OGNL) injection vulnerability that may allow an unauthenticated attacker to execute code.,2021-11-03,Apply updates per vendor instructions.,2021-11-17,TRUE,0.9444,0.9999,2026-04-20,0.9444,0.9999,2026-04-23,NA,NA,NA,0
CVE-2022-24112,Apache,APISIX,Apache APISIX Authentication Bypass Vulnerability,Apache APISIX contains an authentication bypass vulnerability that allows for remote code execution.,2022-08-25,Apply updates per vendor instructions.,2022-09-15,TRUE,0.94439,0.99989,2026-04-20,0.94439,0.99988,2026-04-23,NA,NA,NA,0
CVE-2022-1040,Sophos,Firewall,Sophos Firewall Authentication Bypass Vulnerability,An authentication bypass vulnerability in User Portal and Webadmin of Sophos Firewall allows for remote code execution.,2022-03-31,Apply updates per vendor instructions.,2022-04-21,TRUE,0.94439,0.99989,2026-04-20,0.94439,0.99989,2026-04-23,NA,NA,NA,0
CVE-2017-10271,Oracle,WebLogic Server,Oracle Corporation WebLogic Server Remote Code Execution Vulnerability,Oracle Corporation WebLogic Server contains a vulnerability that allows for remote code execution.,2022-02-10,Apply updates per vendor instructions.,2022-08-10,TRUE,0.94439,0.99989,2026-04-20,0.94439,0.99989,2026-04-23,NA,NA,NA,0
CVE-2020-14883,Oracle,WebLogic Server,Oracle WebLogic Server Unspecified Vulnerability,"Oracle WebLogic Server contains an unspecified vulnerability in the Console component with high impacts to confidentilaity, integrity, and availability.",2021-11-03,Apply updates per vendor instructions.,2022-05-03,TRUE,0.94439,0.9999,2026-04-20,0.94439,0.99989,2026-04-23,NA,NA,NA,0
CVE-2021-43798,Grafana Labs,Grafana,Grafana Path Traversal Vulnerability,Grafana contains a path traversal vulnerability that could allow access to local files.,2025-10-09,"Apply mitigations per vendor instructions, follow applicable BOD 22-01 guidance for cloud services, or discontinue use of the product if mitigations are unavailable.",2025-10-30,TRUE,0.94438,0.99988,2026-04-20,0.94438,0.99988,2026-04-23,NA,NA,NA,0
CVE-2023-35078,Ivanti,Endpoint Manager Mobile (EPMM),Ivanti Endpoint Manager Mobile Authentication Bypass Vulnerability,"Ivanti Endpoint Manager Mobile (EPMM, previously branded MobileIron Core) contains an authentication bypass vulnerability that allows unauthenticated access to specific API paths. An attacker with access to these API paths can access personally identifiable information (PII) such as names, phone numbers, and other mobile device details for users on a vulnerable system. An attacker can also make other configuration changes including installing software and modifying security profiles on registered devices.",2023-07-25,Apply mitigations per vendor instructions or discontinue use of the product if mitigations are unavailable.,2023-08-15,TRUE,0.94468,0.99997,2026-04-20,0.94438,0.99988,2026-04-23,NA,NA,NA,-3e-4
CVE-2020-14750,Oracle,WebLogic Server,Oracle WebLogic Server Remote Code Execution Vulnerability,Oracle WebLogic Server contains an unspecified vulnerability allowing an unauthenticated attacker to perform remote code execution. This vulnerability is related to CVE-2020-14882.,2021-11-03,Apply updates per vendor instructions.,2022-05-03,TRUE,0.94438,0.99988,2026-04-20,0.94438,0.99987,2026-04-23,NA,NA,NA,0
CVE-2024-7593,Ivanti,Virtual Traffic Manager,Ivanti Virtual Traffic Manager Authentication Bypass Vulnerability,"Ivanti Virtual Traffic Manager contains an authentication bypass vulnerability that allows a remote, unauthenticated attacker to create a chosen administrator account.",2024-09-24,Apply mitigations per vendor instructions or discontinue use of the product if mitigations are unavailable.,2024-10-15,TRUE,0.94436,0.99987,2026-04-20,0.94436,0.99987,2026-04-23,NA,NA,NA,0
CVE-2023-46604,Apache,ActiveMQ,Apache ActiveMQ Deserialization of Untrusted Data Vulnerability,Apache ActiveMQ contains a deserialization of untrusted data vulnerability that may allow a remote attacker with network access to a broker to run shell commands by manipulating serialized class types in the OpenWire protocol to cause the broker to instantiate any class on the classpath.,2023-11-02,Apply mitigations per vendor instructions or discontinue use of the product if mitigations are unavailable.,2023-11-23,TRUE,0.94436,0.99987,2026-04-20,0.94436,0.99987,2026-04-23,NA,NA,NA,0
CVE-2023-46747,F5,BIG-IP Configuration Utility,F5 BIG-IP Configuration Utility Authentication Bypass Vulnerability,F5 BIG-IP Configuration utility contains an authentication bypass using an alternate path or channel vulnerability due to undisclosed requests that may allow an unauthenticated attacker with network access to the BIG-IP system through the management port and/or self IP addresses to execute system commands. This vulnerability can be used in conjunction with CVE-2023-46748.,2023-10-31,Apply mitigations per vendor instructions or discontinue use of the product if mitigations are unavailable.,2023-11-21,TRUE,0.94436,0.99986,2026-04-20,0.94436,0.99986,2026-04-23,NA,NA,NA,0
CVE-2023-40044,Progress,WS_FTP Server,Progress WS_FTP Server Deserialization of Untrusted Data Vulnerability,Progress WS_FTP Server contains a deserialization of untrusted data vulnerability in the Ad Hoc Transfer module that allows an authenticated attacker to execute remote commands on the underlying operating system.,2023-10-05,Apply mitigations per vendor instructions or discontinue use of the product if mitigations are unavailable.,2023-10-26,TRUE,0.94436,0.99987,2026-04-20,0.94436,0.99986,2026-04-23,NA,NA,NA,0
CVE-2019-6340,Drupal,Core,Drupal Core Remote Code Execution Vulnerability,"In Drupal Core, some field types do not properly sanitize data from non-form sources. This can lead to arbitrary PHP code execution in some cases.",2022-03-25,Apply updates per vendor instructions.,2022-04-15,TRUE,0.94436,0.99988,2026-04-20,0.94436,0.99987,2026-04-23,NA,NA,NA,0
CVE-2021-36260,Hikvision,Security cameras web server,Hikvision Improper Input Validation,A command injection vulnerability in the web server of some Hikvision product. Due to the insufficient input validation.,2022-01-10,Apply updates per vendor instructions.,2022-01-24,TRUE,0.94436,0.99986,2026-04-20,0.94436,0.99986,2026-04-23,NA,NA,NA,0
CVE-2022-29464,WSO2,Multiple Products,WSO2 Multiple Products Unrestrictive Upload of File Vulnerability,"Multiple WSO2 products allow for unrestricted file upload, resulting in remote code execution.",2022-04-25,Apply updates per vendor instructions.,2022-05-16,TRUE,0.94434,0.99986,2026-04-20,0.94434,0.99985,2026-04-23,9.8,CRITICAL,10,0
CVE-2021-40438,Apache,Apache,Apache HTTP Server-Side Request Forgery (SSRF),A crafted request uri-path can cause mod_proxy to forward the request to an origin server choosen by the remote user. This issue affects Apache HTTP Server 2.4.48 and earlier.,2021-12-01,Apply updates per vendor instructions.,2021-12-15,TRUE,0.94432,0.99986,2026-04-20,0.94432,0.99985,2026-04-23,NA,NA,NA,0
CVE-2024-28995,SolarWinds,Serv-U,SolarWinds Serv-U Path Traversal Vulnerability ,SolarWinds Serv-U contains a path traversal vulnerability that allows an attacker access to read sensitive files on the host machine.,2024-07-17,Apply mitigations per vendor instructions or discontinue use of the product if mitigations are unavailable.,2024-08-07,TRUE,0.94431,0.99985,2026-04-20,0.94431,0.99985,2026-04-23,NA,NA,NA,0
CVE-2018-11776,Apache,Struts,Apache Struts Remote Code Execution Vulnerability,"Apache Struts contains a vulnerability that allows for remote code execution under two circumstances. One, where the alwaysSelectFullNamespace option is true and the value isn't set for a result defined in underlying configurations and in same time, its upper package configuration have no or wildcard namespace.  Or, using URL tag which doesn't have value and action set and in same time, its upper package configuration have no or wildcard namespace.",2021-11-03,Apply updates per vendor instructions.,2022-05-03,TRUE,0.94431,0.99985,2026-04-20,0.94431,0.99984,2026-04-23,NA,NA,NA,0
CVE-2019-16759,vBulletin,vBulletin,vBulletin PHP Module Remote Code Execution Vulnerability,The PHP module within vBulletin contains an unspecified vulnerability that allows for remote code execution via the widgetConfig[code] parameter in an ajax/render/widget_php routestring request.,2021-11-03,Apply updates per vendor instructions.,2022-05-03,TRUE,0.9443,0.99985,2026-04-20,0.9443,0.99984,2026-04-23,NA,NA,NA,0
CVE-2019-7609,Elastic,Kibana,Kibana Arbitrary Code Execution,Kibana contain an arbitrary code execution flaw in the Timelion visualizer.,2022-01-10,Apply updates per vendor instructions.,2022-07-10,TRUE,0.94429,0.99984,2026-04-20,0.94429,0.99984,2026-04-23,NA,NA,NA,0
CVE-2017-7269,Microsoft,Internet Information Services (IIS),Microsoft Windows Server Buffer Overflow Vulnerability,"Microsoft Windows Server 2003 R2 contains a buffer overflow vulnerability in Internet Information Services (IIS) 6.0 which allows remote attackers to execute code via a long header beginning with ""If: <http://"" in a PROPFIND request.",2021-11-03,Apply updates per vendor instructions.,2022-05-03,TRUE,0.94429,0.99984,2026-04-20,0.94429,0.99983,2026-04-23,NA,NA,NA,0
CVE-2022-22965,VMware,Spring Framework,Spring Framework JDK 9+ Remote Code Execution Vulnerability,Spring MVC or Spring WebFlux application running on JDK 9+ may be vulnerable to remote code execution (RCE) via data binding.,2022-04-04,Apply updates per vendor instructions.,2022-04-25,TRUE,0.94428,0.99983,2026-04-20,0.94428,0.99983,2026-04-23,NA,NA,NA,0
